{
  "$schema": "https://json-schema.org/draft/2020-12/schema",
  "$id": "https://vfxforge.local/schema/vfx.recipe.schema.json",
  "title": "VFX Forge Recipe",
  "type": "object",
  "additionalProperties": false,
  "required": ["recipe_id", "recipe_version", "matcher", "document"],
  "properties": {
    "recipe_id": {"type": "string", "pattern": "^[A-Za-z][A-Za-z0-9_.-]{1,63}$"},
    "recipe_version": {"type": "integer", "minimum": 1},
    "description": {"type": "string"},
    "display_name": {"type": "string"},
    "matcher": {"type": "object"},
    "priority": {"type": "integer"},
    "seed": {"type": "integer"},
    "required_gameplay": {"type": "array", "items": {"type": "string"}},
    "supported_gameplay": {"type": "array", "items": {"type": "string"}},
    "consumed_gameplay": {"type": "array", "items": {"type": "string"}},
    "gameplay_scaling": {"type": "object"},
    "timing": {"type": "object"},
    "layer_roles": {
      "type": "array",
      "items": {
        "type": "object",
        "required": ["id"],
        "properties": {
          "id": {"type": "string"},
          "required": {"type": "boolean"},
          "correction_priority": {"type": "integer"}
        }
      }
    },
    "bindings": {"type": "array"},
    "intensity_scale": {"type": "object"},
    "document": {"type": "object"}
  }
}
