{
  "recipe_id": "boss.eruption_2x2",
  "recipe_version": 1,
  "description": "Delayed 2x2 Eruption",
  "display_name": "Delayed 2x2 Eruption",
  "matcher": {
    "intent.kind": "boss_ability",
    "gameplay.shape": "rectangle"
  },
  "priority": 105,
  "seed": 55310,
  "document": {
    "schema_version": 1,
    "name": "Boss 2x2 Eruption",
    "duration": 1.35,
    "loop": false,
    "seed": 55312,
    "metadata": {
      "author": "",
      "description": "",
      "created_with": "VFX Forge 0.1.0",
      "notes": ""
    },
    "tags": [
      "boss",
      "eruption",
      "rectangle"
    ],
    "layers": [
      {
        "id": "warning_rect",
        "type": "decal",
        "name": "Warning Rectangle",
        "enabled": true,
        "start": 0.0,
        "duration": 1.1,
        "properties": {
          "texture": "",
          "size": [
            3.0,
            3.0
          ],
          "color": "#FF7040AA",
          "height": 0.02,
          "fade": true,
          "rotate": 0.0
        },
        "material": {
          "blend_mode": "additive",
          "unshaded": true,
          "billboard": "enabled",
          "depth_draw": "always",
          "texture": "",
          "tint": "#FFFFFFFF",
          "uv_scroll": [
            0.0,
            0.0
          ],
          "distortion": 0.0,
          "dissolve": 0.0,
          "fresnel": 0.0,
          "emissive_intensity": 1.0
        },
        "curves": {
          "scale": {
            "interpolation": "linear",
            "points": [
              {
                "x": 0.0,
                "y": 0.0
              },
              {
                "x": 0.2,
                "y": 1.0
              },
              {
                "x": 1.0,
                "y": 0.8
              }
            ]
          }
        },
        "gradient": [
          {
            "position": 0.0,
            "color": "#FFFFFFFF"
          },
          {
            "position": 1.0,
            "color": "#00000000"
          }
        ]
      },
      {
        "id": "resolve_marker",
        "type": "event_marker",
        "name": "Resolve",
        "enabled": true,
        "start": 1.1,
        "duration": 0.001,
        "properties": {
          "event_id": "damage_frame"
        },
        "material": {
          "blend_mode": "additive",
          "unshaded": true,
          "billboard": "enabled",
          "depth_draw": "always",
          "texture": "",
          "tint": "#FFFFFFFF",
          "uv_scroll": [
            0.0,
            0.0
          ],
          "distortion": 0.0,
          "dissolve": 0.0,
          "fresnel": 0.0,
          "emissive_intensity": 1.0
        },
        "curves": {},
        "gradient": [
          {
            "position": 0.0,
            "color": "#FFFFFFFF"
          },
          {
            "position": 1.0,
            "color": "#00000000"
          }
        ]
      },
      {
        "id": "eruption_burst",
        "type": "particle",
        "name": "Eruption Burst",
        "enabled": true,
        "start": 1.1,
        "duration": 0.25,
        "properties": {
          "amount": 96,
          "one_shot": true,
          "lifetime": 0.35,
          "explosiveness": 0.9,
          "randomness": 0.2,
          "fixed_fps": 0,
          "local_coords": false,
          "emission_shape": "box",
          "emission_box_extents": [
            1.5,
            0.5,
            1.5
          ],
          "emission_radius": 1.0,
          "emission_height": 0.1,
          "direction": [
            0.0,
            1.0,
            0.0
          ],
          "spread": 55.0,
          "initial_velocity_min": 1.0,
          "initial_velocity_max": 3.0,
          "gravity": [
            0.0,
            -2.0,
            0.0
          ],
          "damping": 0.0,
          "radial_accel": 0.0,
          "tangential_accel": 0.0,
          "turbulence": 0.0,
          "attractor_strength": 0.0,
          "attractor_position": [
            0.0,
            0.0,
            0.0
          ],
          "scale_min": 0.08,
          "scale_max": 0.18,
          "rotation_min": 0.0,
          "rotation_max": 360.0,
          "angular_velocity_min": -90.0,
          "angular_velocity_max": 90.0,
          "texture": "",
          "color": "#FF8844FF"
        },
        "material": {
          "blend_mode": "additive",
          "unshaded": true,
          "billboard": "enabled",
          "depth_draw": "always",
          "texture": "",
          "tint": "#FFFFFFFF",
          "uv_scroll": [
            0.0,
            0.0
          ],
          "distortion": 0.0,
          "dissolve": 0.0,
          "fresnel": 0.0,
          "emissive_intensity": 1.0
        },
        "curves": {
          "alpha": {
            "interpolation": "linear",
            "points": [
              {
                "x": 0.0,
                "y": 0.0
              },
              {
                "x": 0.1,
                "y": 1.0
              },
              {
                "x": 1.0,
                "y": 0.0
              }
            ]
          }
        },
        "gradient": [
          {
            "position": 0.0,
            "color": "#FFFFFFFF"
          },
          {
            "position": 1.0,
            "color": "#00000000"
          }
        ]
      }
    ],
    "dependencies": {
      "textures": [],
      "meshes": [],
      "effects": []
    },
    "timeline": {
      "events": [
        {
          "id": "damage_frame",
          "event_id": "damage_frame",
          "time": 1.1,
          "data": {
            "presentation": true
          }
        }
      ],
      "snap": 0.05
    },
    "camera_presets": {
      "front": {
        "position": [
          0.0,
          1.2,
          5.0
        ],
        "target": [
          0.0,
          0.8,
          0.0
        ],
        "fov": 45.0
      },
      "mmo": {
        "position": [
          4.5,
          4.0,
          5.5
        ],
        "target": [
          0.0,
          0.7,
          0.0
        ],
        "fov": 50.0
      },
      "top": {
        "position": [
          0.0,
          6.0,
          0.0
        ],
        "target": [
          0.0,
          0.0,
          0.0
        ],
        "fov": 45.0
      }
    },
    "budgets": {
      "profile": "Medium",
      "custom": {}
    },
    "export": {
      "godot_version": "4.x",
      "folder_name": "effect",
      "include_metadata": true,
      "embed_document": true,
      "copy_textures": true,
      "copy_meshes": true
    }
  },
  "intensity_scale": {
    "subtle": 0.7,
    "standard": 1.0,
    "strong": 1.25,
    "boss": 1.5
  },
  "gameplay_scaling": {
    "rectangle_size_layers": [
      "warning_rect"
    ],
    "remove_layers_for_shape": {
      "rectangle": [
        "warning_circle",
        "warning_line"
      ]
    }
  },
  "required_gameplay": [
    "gameplay.shape",
    "gameplay.width_tiles",
    "gameplay.length_tiles",
    "gameplay.tell_ms"
  ],
  "supported_gameplay": [
    "gameplay.shape",
    "gameplay.width_tiles",
    "gameplay.length_tiles",
    "gameplay.tell_ms"
  ],
  "consumed_gameplay": [
    "gameplay.shape",
    "gameplay.width_tiles",
    "gameplay.length_tiles",
    "gameplay.tell_ms"
  ],
  "timing": {
    "post_resolve_sec": 0.25,
    "resolve_event_id": "damage_frame",
    "resolve_layer_ids": [
      "eruption_burst"
    ]
  },
  "layer_roles": [
    {
      "id": "warning_rect",
      "required": true,
      "correction_priority": 5,
      "semantic_role": "warning_geometry"
    },
    {
      "id": "resolve_marker",
      "required": true,
      "correction_priority": 1,
      "semantic_role": "resolve_event"
    },
    {
      "id": "eruption_burst",
      "required": true,
      "correction_priority": 10,
      "semantic_role": "resolve_visual"
    }
  ]
}
