{
  "recipe_id": "telegraph.line",
  "recipe_version": 1,
  "description": "Line Ground Telegraph",
  "display_name": "Line Ground Telegraph",
  "matcher": {
    "intent.kind": "ground_telegraph",
    "intent.purpose": "danger_warning",
    "gameplay.shape": "line"
  },
  "priority": 100,
  "seed": 55311,
  "required_gameplay": [
    "gameplay.shape",
    "gameplay.length_tiles",
    "gameplay.width_tiles",
    "gameplay.tell_ms"
  ],
  "supported_gameplay": [
    "gameplay.shape",
    "gameplay.length_tiles",
    "gameplay.width_tiles",
    "gameplay.tell_ms"
  ],
  "consumed_gameplay": [
    "gameplay.shape",
    "gameplay.length_tiles",
    "gameplay.width_tiles",
    "gameplay.tell_ms"
  ],
  "gameplay_scaling": {
    "line_size_layers": [
      "warning_line"
    ],
    "remove_layers_for_shape": {
      "line": [
        "warning_circle",
        "warning_rect"
      ]
    }
  },
  "timing": {
    "post_resolve_sec": 0.15,
    "resolve_event_id": "resolve"
  },
  "layer_roles": [
    {
      "id": "warning_line",
      "required": true,
      "correction_priority": 5
    },
    {
      "id": "resolve_marker",
      "required": true,
      "correction_priority": 1
    }
  ],
  "document": {
    "schema_version": 1,
    "name": "Line Ground Telegraph",
    "duration": 1.5,
    "loop": false,
    "seed": 55311,
    "metadata": {
      "author": "",
      "description": "",
      "created_with": "VFX Forge 0.1.0",
      "notes": ""
    },
    "tags": [
      "telegraph",
      "line"
    ],
    "layers": [
      {
        "id": "warning_line",
        "type": "decal",
        "name": "Warning Line",
        "enabled": true,
        "start": 0.0,
        "duration": 1.2,
        "properties": {
          "texture": "",
          "size": [
            1.0,
            3.0
          ],
          "color": "#FF465C78",
          "height": 0.02,
          "fade": true,
          "rotate": 0.0
        },
        "material": {
          "blend_mode": "additive",
          "unshaded": true,
          "billboard": "enabled",
          "depth_draw": "always",
          "texture": "",
          "tint": "#FFFFFFFF",
          "uv_scroll": [
            0.0,
            0.0
          ],
          "distortion": 0.0,
          "dissolve": 0.0,
          "fresnel": 0.0,
          "emissive_intensity": 1.0
        },
        "curves": {
          "scale": {
            "interpolation": "linear",
            "points": [
              {
                "x": 0.0,
                "y": 0.0
              },
              {
                "x": 0.2,
                "y": 1.0
              },
              {
                "x": 1.0,
                "y": 0.8
              }
            ]
          }
        },
        "gradient": [
          {
            "position": 0.0,
            "color": "#FFFFFFFF"
          },
          {
            "position": 1.0,
            "color": "#00000000"
          }
        ]
      },
      {
        "id": "edge_dust",
        "type": "particle",
        "name": "Edge Dust",
        "enabled": true,
        "start": 0.0,
        "duration": 1.2,
        "properties": {
          "amount": 32,
          "one_shot": true,
          "lifetime": 0.6,
          "explosiveness": 0.6,
          "randomness": 0.15,
          "fixed_fps": 0,
          "local_coords": false,
          "emission_shape": "line",
          "emission_box_extents": [
            0.25,
            0.25,
            0.25
          ],
          "emission_radius": 0.15,
          "emission_height": 0.1,
          "direction": [
            0.0,
            1.0,
            0.0
          ],
          "spread": 35.0,
          "initial_velocity_min": 0.5,
          "initial_velocity_max": 2.0,
          "gravity": [
            0.0,
            -1.5,
            0.0
          ],
          "damping": 0.0,
          "radial_accel": 0.0,
          "tangential_accel": 0.0,
          "turbulence": 0.0,
          "attractor_strength": 0.0,
          "attractor_position": [
            0.0,
            0.0,
            0.0
          ],
          "scale_min": 0.05,
          "scale_max": 0.12,
          "rotation_min": 0.0,
          "rotation_max": 360.0,
          "angular_velocity_min": -90.0,
          "angular_velocity_max": 90.0,
          "texture": "",
          "color": "#FF8899AA"
        },
        "material": {
          "blend_mode": "additive",
          "unshaded": true,
          "billboard": "enabled",
          "depth_draw": "always",
          "texture": "",
          "tint": "#FFFFFFFF",
          "uv_scroll": [
            0.0,
            0.0
          ],
          "distortion": 0.0,
          "dissolve": 0.0,
          "fresnel": 0.0,
          "emissive_intensity": 1.0
        },
        "curves": {
          "alpha": {
            "interpolation": "linear",
            "points": [
              {
                "x": 0.0,
                "y": 0.0
              },
              {
                "x": 0.1,
                "y": 1.0
              },
              {
                "x": 1.0,
                "y": 0.0
              }
            ]
          }
        },
        "gradient": [
          {
            "position": 0.0,
            "color": "#FFFFFFFF"
          },
          {
            "position": 1.0,
            "color": "#00000000"
          }
        ]
      },
      {
        "id": "resolve_marker",
        "type": "event_marker",
        "name": "Resolve",
        "enabled": true,
        "start": 1.2,
        "duration": 0.001,
        "properties": {
          "event_id": "damage_frame"
        },
        "material": {
          "blend_mode": "additive",
          "unshaded": true,
          "billboard": "enabled",
          "depth_draw": "always",
          "texture": "",
          "tint": "#FFFFFFFF",
          "uv_scroll": [
            0.0,
            0.0
          ],
          "distortion": 0.0,
          "dissolve": 0.0,
          "fresnel": 0.0,
          "emissive_intensity": 1.0
        },
        "curves": {},
        "gradient": [
          {
            "position": 0.0,
            "color": "#FFFFFFFF"
          },
          {
            "position": 1.0,
            "color": "#00000000"
          }
        ]
      }
    ],
    "dependencies": {
      "textures": [],
      "meshes": [],
      "effects": []
    },
    "timeline": {
      "events": [
        {
          "id": "resolve",
          "event_id": "resolve",
          "time": 1.2,
          "data": {
            "presentation": true
          }
        }
      ],
      "snap": 0.05
    },
    "camera_presets": {
      "front": {
        "position": [
          0.0,
          1.2,
          5.0
        ],
        "target": [
          0.0,
          0.8,
          0.0
        ],
        "fov": 45.0
      },
      "mmo": {
        "position": [
          4.5,
          4.0,
          5.5
        ],
        "target": [
          0.0,
          0.7,
          0.0
        ],
        "fov": 50.0
      },
      "top": {
        "position": [
          0.0,
          6.0,
          0.0
        ],
        "target": [
          0.0,
          0.0,
          0.0
        ],
        "fov": 45.0
      }
    },
    "budgets": {
      "profile": "Medium",
      "custom": {}
    },
    "export": {
      "godot_version": "4.x",
      "folder_name": "effect",
      "include_metadata": true,
      "embed_document": true,
      "copy_textures": true,
      "copy_meshes": true
    }
  },
  "intensity_scale": {
    "subtle": 0.7,
    "standard": 1.0,
    "strong": 1.25,
    "boss": 1.5
  }
}
