{
  "recipe_id": "lightning.strike",
  "recipe_version": 1,
  "description": "Lightning Strike",
  "display_name": "Lightning Strike",
  "matcher": {
    "intent.kind": "lightning_strike",
    "intent.element": "lightning"
  },
  "priority": 100,
  "seed": 40391,
  "document": {
    "schema_version": 1,
    "name": "Fire Impact",
    "duration": 1.35,
    "loop": false,
    "seed": 40391,
    "metadata": {
      "author": "",
      "description": "",
      "created_with": "VFX Forge 0.1.0",
      "notes": ""
    },
    "tags": [
      "lightning",
      "strike",
      "impact"
    ],
    "layers": [
      {
        "name": "Scorch",
        "enabled": true,
        "start": 0.0,
        "duration": 1.35,
        "properties": {
          "texture": "",
          "size": [
            2.2,
            2.2
          ],
          "color": "#FF6A2E80",
          "height": 0.02,
          "fade": true,
          "rotate": 0.0
        },
        "material": {
          "blend_mode": "additive",
          "unshaded": true,
          "billboard": "enabled",
          "depth_draw": "always",
          "texture": "",
          "tint": "#FFFFFFFF",
          "uv_scroll": [
            0.0,
            0.0
          ],
          "distortion": 0.0,
          "dissolve": 0.0,
          "fresnel": 0.0,
          "emissive_intensity": 1.0
        },
        "curves": {
          "scale": {
            "interpolation": "linear",
            "points": [
              {
                "x": 0.0,
                "y": 0.0
              },
              {
                "x": 0.2,
                "y": 1.0
              },
              {
                "x": 1.0,
                "y": 0.8
              }
            ]
          }
        },
        "gradient": [
          {
            "position": 0.0,
            "color": "#FFFFFFFF"
          },
          {
            "position": 1.0,
            "color": "#00000000"
          }
        ],
        "id": "scorch",
        "type": "decal"
      },
      {
        "name": "Embers",
        "enabled": true,
        "start": 0.0,
        "duration": 1.2,
        "properties": {
          "amount": 88,
          "one_shot": true,
          "lifetime": 1.0,
          "explosiveness": 0.8,
          "randomness": 0.15,
          "fixed_fps": 0,
          "local_coords": false,
          "emission_shape": "cone",
          "emission_box_extents": [
            0.25,
            0.25,
            0.25
          ],
          "emission_radius": 0.5,
          "emission_height": 0.1,
          "direction": [
            0.0,
            1.0,
            0.0
          ],
          "spread": 48.0,
          "initial_velocity_min": 1.8,
          "initial_velocity_max": 3.8,
          "gravity": [
            0.0,
            -2.0,
            0.0
          ],
          "damping": 0.0,
          "radial_accel": 0.0,
          "tangential_accel": 0.0,
          "turbulence": 0.0,
          "attractor_strength": 0.0,
          "attractor_position": [
            0.0,
            0.0,
            0.0
          ],
          "scale_min": 0.08,
          "scale_max": 0.16,
          "rotation_min": 0.0,
          "rotation_max": 360.0,
          "angular_velocity_min": -90.0,
          "angular_velocity_max": 90.0,
          "texture": "",
          "color": "#FF9A3CFF"
        },
        "material": {
          "blend_mode": "additive",
          "unshaded": true,
          "billboard": "enabled",
          "depth_draw": "always",
          "texture": "",
          "tint": "#FFFFFFFF",
          "uv_scroll": [
            0.0,
            0.0
          ],
          "distortion": 0.0,
          "dissolve": 0.0,
          "fresnel": 0.0,
          "emissive_intensity": 1.0
        },
        "curves": {
          "scale": {
            "interpolation": "linear",
            "points": [
              {
                "x": 0.0,
                "y": 0.35
              },
              {
                "x": 0.15,
                "y": 1.0
              },
              {
                "x": 1.0,
                "y": 0.0
              }
            ]
          },
          "alpha": {
            "interpolation": "linear",
            "points": [
              {
                "x": 0.0,
                "y": 0.0
              },
              {
                "x": 0.1,
                "y": 1.0
              },
              {
                "x": 0.75,
                "y": 1.0
              },
              {
                "x": 1.0,
                "y": 0.0
              }
            ]
          },
          "velocity": {
            "interpolation": "linear",
            "points": [
              {
                "x": 0.0,
                "y": 1.0
              },
              {
                "x": 1.0,
                "y": 0.2
              }
            ]
          }
        },
        "gradient": [
          {
            "position": 0.0,
            "color": "#FFFFFFFF"
          },
          {
            "position": 1.0,
            "color": "#00000000"
          }
        ],
        "id": "embers",
        "type": "particle"
      },
      {
        "name": "Fireball",
        "enabled": true,
        "start": 0.0,
        "duration": 0.7,
        "properties": {
          "texture": "",
          "size": [
            1.6,
            1.6
          ],
          "flipbook_columns": 1,
          "flipbook_rows": 1,
          "flipbook_frames": 1,
          "flipbook_fps": 12.0,
          "flipbook_loop": false,
          "flipbook_start_frame": 0,
          "random_start": false,
          "billboard": "enabled",
          "pixel_snap": false,
          "color": "#FFB05CFF"
        },
        "material": {
          "blend_mode": "additive",
          "unshaded": true,
          "billboard": "enabled",
          "depth_draw": "always",
          "texture": "",
          "tint": "#FFFFFFFF",
          "uv_scroll": [
            0.0,
            0.0
          ],
          "distortion": 0.0,
          "dissolve": 0.0,
          "fresnel": 0.0,
          "emissive_intensity": 1.0
        },
        "curves": {
          "scale": {
            "interpolation": "linear",
            "points": [
              {
                "x": 0.0,
                "y": 0.5
              },
              {
                "x": 0.15,
                "y": 1.0
              },
              {
                "x": 1.0,
                "y": 0.0
              }
            ]
          }
        },
        "gradient": [
          {
            "position": 0.0,
            "color": "#FFFFFFFF"
          },
          {
            "position": 1.0,
            "color": "#00000000"
          }
        ],
        "id": "fireball",
        "type": "sprite"
      },
      {
        "name": "Fire Light",
        "enabled": true,
        "start": 0.0,
        "duration": 0.9,
        "properties": {
          "color": "#FF6B2EFF",
          "energy": 5.0,
          "range": 4.0,
          "shadow_enabled": false,
          "fade": true
        },
        "material": {
          "blend_mode": "additive",
          "unshaded": true,
          "billboard": "enabled",
          "depth_draw": "always",
          "texture": "",
          "tint": "#FFFFFFFF",
          "uv_scroll": [
            0.0,
            0.0
          ],
          "distortion": 0.0,
          "dissolve": 0.0,
          "fresnel": 0.0,
          "emissive_intensity": 1.0
        },
        "curves": {
          "energy": {
            "interpolation": "linear",
            "points": [
              {
                "x": 0.0,
                "y": 0.0
              },
              {
                "x": 0.12,
                "y": 1.0
              },
              {
                "x": 0.7,
                "y": 0.55
              },
              {
                "x": 1.0,
                "y": 0.0
              }
            ]
          }
        },
        "gradient": [
          {
            "position": 0.0,
            "color": "#FFFFFFFF"
          },
          {
            "position": 1.0,
            "color": "#00000000"
          }
        ],
        "id": "fire_light",
        "type": "light"
      }
    ],
    "dependencies": {
      "textures": [],
      "meshes": [],
      "effects": []
    },
    "timeline": {
      "events": [],
      "snap": 0.05
    },
    "camera_presets": {
      "front": {
        "position": [
          0.0,
          1.2,
          5.0
        ],
        "target": [
          0.0,
          0.8,
          0.0
        ],
        "fov": 45.0
      },
      "mmo": {
        "position": [
          4.5,
          4.0,
          5.5
        ],
        "target": [
          0.0,
          0.7,
          0.0
        ],
        "fov": 50.0
      },
      "top": {
        "position": [
          0.0,
          6.0,
          0.0
        ],
        "target": [
          0.0,
          0.0,
          0.0
        ],
        "fov": 45.0
      }
    },
    "budgets": {
      "profile": "Medium",
      "custom": {}
    },
    "export": {
      "godot_version": "4.x",
      "folder_name": "fire_impact",
      "include_metadata": true,
      "embed_document": true,
      "copy_textures": true,
      "copy_meshes": true
    }
  },
  "intensity_scale": {
    "subtle": 0.7,
    "standard": 1.0,
    "strong": 1.25,
    "boss": 1.5
  }
}
