{
  "recipe_id": "impact.neutral",
  "recipe_version": 1,
  "description": "Neutral Impact",
  "display_name": "Neutral Impact",
  "matcher": {
    "intent.kind": "impact",
    "intent.element": "neutral"
  },
  "priority": 100,
  "seed": 18473,
  "supported_gameplay": [],
  "consumed_gameplay": [],
  "document": {
    "schema_version": 1,
    "name": "Arcane Impact",
    "duration": 1.5,
    "loop": false,
    "seed": 18473,
    "metadata": {
      "author": "",
      "description": "",
      "created_with": "VFX Forge 0.1.0",
      "notes": ""
    },
    "tags": [
      "impact",
      "magic",
      "arcane"
    ],
    "layers": [
      {
        "name": "Rune Circle",
        "enabled": true,
        "start": 0.0,
        "duration": 1.4,
        "properties": {
          "texture": "",
          "size": [
            2.4,
            2.4
          ],
          "color": "#765CFF78",
          "height": 0.02,
          "fade": true,
          "rotate": 0.0
        },
        "material": {
          "blend_mode": "additive",
          "unshaded": true,
          "billboard": "enabled",
          "depth_draw": "always",
          "texture": "",
          "tint": "#FFFFFFFF",
          "uv_scroll": [
            0.0,
            0.0
          ],
          "distortion": 0.0,
          "dissolve": 0.0,
          "fresnel": 0.0,
          "emissive_intensity": 1.0
        },
        "curves": {
          "scale": {
            "interpolation": "linear",
            "points": [
              {
                "x": 0.0,
                "y": 0.0
              },
              {
                "x": 0.2,
                "y": 1.0
              },
              {
                "x": 1.0,
                "y": 0.8
              }
            ]
          }
        },
        "gradient": [
          {
            "position": 0.0,
            "color": "#FFFFFFFF"
          },
          {
            "position": 1.0,
            "color": "#00000000"
          }
        ],
        "id": "rune_circle",
        "type": "decal"
      },
      {
        "name": "Sparks",
        "enabled": true,
        "start": 0.0,
        "duration": 1.0,
        "properties": {
          "amount": 64,
          "one_shot": true,
          "lifetime": 0.75,
          "explosiveness": 0.8,
          "randomness": 0.15,
          "fixed_fps": 0,
          "local_coords": false,
          "emission_shape": "sphere",
          "emission_box_extents": [
            0.25,
            0.25,
            0.25
          ],
          "emission_radius": 0.18,
          "emission_height": 0.1,
          "direction": [
            0.0,
            1.0,
            0.0
          ],
          "spread": 35.0,
          "initial_velocity_min": 2.4,
          "initial_velocity_max": 4.2,
          "gravity": [
            0.0,
            -4.0,
            0.0
          ],
          "damping": 0.0,
          "radial_accel": 0.0,
          "tangential_accel": 0.0,
          "turbulence": 0.0,
          "attractor_strength": 0.0,
          "attractor_position": [
            0.0,
            0.0,
            0.0
          ],
          "scale_min": 0.04,
          "scale_max": 0.1,
          "rotation_min": 0.0,
          "rotation_max": 360.0,
          "angular_velocity_min": -90.0,
          "angular_velocity_max": 90.0,
          "texture": ""
        },
        "material": {
          "blend_mode": "additive",
          "unshaded": true,
          "billboard": "enabled",
          "depth_draw": "always",
          "texture": "",
          "tint": "#FFFFFFFF",
          "uv_scroll": [
            0.0,
            0.0
          ],
          "distortion": 0.0,
          "dissolve": 0.0,
          "fresnel": 0.0,
          "emissive_intensity": 1.0
        },
        "curves": {
          "scale": {
            "interpolation": "linear",
            "points": [
              {
                "x": 0.0,
                "y": 0.35
              },
              {
                "x": 0.15,
                "y": 1.0
              },
              {
                "x": 1.0,
                "y": 0.0
              }
            ]
          },
          "alpha": {
            "interpolation": "linear",
            "points": [
              {
                "x": 0.0,
                "y": 0.0
              },
              {
                "x": 0.1,
                "y": 1.0
              },
              {
                "x": 0.75,
                "y": 1.0
              },
              {
                "x": 1.0,
                "y": 0.0
              }
            ]
          },
          "velocity": {
            "interpolation": "linear",
            "points": [
              {
                "x": 0.0,
                "y": 1.0
              },
              {
                "x": 1.0,
                "y": 0.2
              }
            ]
          }
        },
        "gradient": [
          {
            "position": 0.0,
            "color": "#FFFFFFFF"
          },
          {
            "position": 1.0,
            "color": "#00000000"
          }
        ],
        "id": "sparks",
        "type": "particle"
      },
      {
        "name": "Flash",
        "enabled": true,
        "start": 0.0,
        "duration": 0.32,
        "properties": {
          "texture": "",
          "size": [
            1.8,
            1.8
          ],
          "flipbook_columns": 1,
          "flipbook_rows": 1,
          "flipbook_frames": 1,
          "flipbook_fps": 12.0,
          "flipbook_loop": false,
          "flipbook_start_frame": 0,
          "random_start": false,
          "billboard": "enabled",
          "pixel_snap": false,
          "color": "#C2B5FFFF"
        },
        "material": {
          "blend_mode": "additive",
          "unshaded": true,
          "billboard": "enabled",
          "depth_draw": "always",
          "texture": "",
          "tint": "#FFFFFFFF",
          "uv_scroll": [
            0.0,
            0.0
          ],
          "distortion": 0.0,
          "dissolve": 0.0,
          "fresnel": 0.0,
          "emissive_intensity": 1.0
        },
        "curves": {
          "scale": {
            "interpolation": "linear",
            "points": [
              {
                "x": 0.0,
                "y": 0.5
              },
              {
                "x": 0.15,
                "y": 1.0
              },
              {
                "x": 1.0,
                "y": 0.0
              }
            ]
          }
        },
        "gradient": [
          {
            "position": 0.0,
            "color": "#FFFFFFFF"
          },
          {
            "position": 1.0,
            "color": "#00000000"
          }
        ],
        "id": "flash",
        "type": "sprite"
      },
      {
        "name": "Impact Light",
        "enabled": true,
        "start": 0.0,
        "duration": 0.55,
        "properties": {
          "color": "#8B78FFFF",
          "energy": 4.0,
          "range": 4.5,
          "shadow_enabled": false,
          "fade": true
        },
        "material": {
          "blend_mode": "additive",
          "unshaded": true,
          "billboard": "enabled",
          "depth_draw": "always",
          "texture": "",
          "tint": "#FFFFFFFF",
          "uv_scroll": [
            0.0,
            0.0
          ],
          "distortion": 0.0,
          "dissolve": 0.0,
          "fresnel": 0.0,
          "emissive_intensity": 1.0
        },
        "curves": {
          "energy": {
            "interpolation": "linear",
            "points": [
              {
                "x": 0.0,
                "y": 0.0
              },
              {
                "x": 0.12,
                "y": 1.0
              },
              {
                "x": 0.7,
                "y": 0.55
              },
              {
                "x": 1.0,
                "y": 0.0
              }
            ]
          }
        },
        "gradient": [
          {
            "position": 0.0,
            "color": "#FFFFFFFF"
          },
          {
            "position": 1.0,
            "color": "#00000000"
          }
        ],
        "id": "impact_light",
        "type": "light"
      }
    ],
    "dependencies": {
      "textures": [],
      "meshes": [],
      "effects": []
    },
    "timeline": {
      "events": [
        {
          "id": "impact",
          "event_id": "impact",
          "time": 0.08,
          "data": {
            "shake": 0.25
          }
        }
      ],
      "snap": 0.05
    },
    "camera_presets": {
      "front": {
        "position": [
          0.0,
          1.2,
          5.0
        ],
        "target": [
          0.0,
          0.8,
          0.0
        ],
        "fov": 45.0
      },
      "mmo": {
        "position": [
          4.5,
          4.0,
          5.5
        ],
        "target": [
          0.0,
          0.7,
          0.0
        ],
        "fov": 50.0
      },
      "top": {
        "position": [
          0.0,
          6.0,
          0.0
        ],
        "target": [
          0.0,
          0.0,
          0.0
        ],
        "fov": 45.0
      }
    },
    "budgets": {
      "profile": "Medium",
      "custom": {}
    },
    "export": {
      "godot_version": "4.x",
      "folder_name": "arcane_impact",
      "include_metadata": true,
      "embed_document": true,
      "copy_textures": true,
      "copy_meshes": true
    }
  },
  "intensity_scale": {
    "subtle": 0.7,
    "standard": 1.0,
    "strong": 1.25,
    "boss": 1.5
  }
}
